{
  "protocolVersion": "1.0",
  "schemaVersion": 1,
  "snapshotId": "2b63ec53-2204-4819-a2ee-4db580d5a2cd",
  "sessionId": "mob_session_7b7c6d325d234be7b6cba379ad12c659",
  "timestamp": 1784102582000,
  "source": "PHONE",
  "deviceId": "android-debug-001",
  "revision": 8,
  "workoutSession": {
    "sessionId": "mob_session_7b7c6d325d234be7b6cba379ad12c659",
    "workoutProgramId": "workout_2e16599e045f4db28243393e45cbf2d7",
    "userId": "user_bd57db6a0240411d85eedd5a588863a2",
    "status": "ACTIVE",
    "startedAt": 1784102400000,
    "finishedAt": null,
    "activeExerciseId": "exercise_198d94eb671f48609039b1d5e6f4fb70",
    "activeSetId": "mob_set_34599d14fb234ff2837ad7dc453ec21a",
    "revision": 8,
    "updatedAt": 1784102582000,
    "updatedBy": "PHONE"
  },
  "exerciseSessions": [],
  "setRecords": [],
  "sensorSamples": [],
  "pendingEvents": []
}
